{
  "schema_version": "mram_write_read_v1",
  "receipt_id": "c5d6e7f8a9b0c1d2e3f4a5b6c7d8e9f0a1b2c3d4e5f6a7b8c9d0e1f2a3b4c5d6",
  "timestamp": "2024-01-15T10:40:00.000Z",
  "write_operation": {
    "address": "0x1000",
    "data_bit": 1,
    "pulse_program": {
      "amplitude": 1.8,
      "duration": 10.0,
      "pulse_shape": "rectangular"
    },
    "write_voltage": 1.8,
    "write_current": 150.0
  },
  "read_operation": {
    "resistance_state": 5000.0,
    "read_voltage": 0.5,
    "read_current": 0.1,
    "decoded_bit": 1
  },
  "threshold_verification": {
    "low_resistance_threshold": 2000.0,
    "high_resistance_threshold": 5000.0,
    "switching_margin": 3000.0,
    "verification_passed": true,
    "tmr_ratio": 1.5
  }
}
